{
  "chunk_id": "chunk-001",
  "source_id": "hanlon-2025-jama",
  "section": "results",
  "char_start": 0,
  "char_end": 190,
  "text": "Across 592 randomized clinical trials including 309,503 participants, SGLT2 inhibitors reduced HbA1c in adults with type 2 diabetes. The magnitude of the effect was smaller at older ages."
}
